{
 "schema": "fishforecast.config/1",
 "updatedAt": "2026-10-29T02:20:00+02:00",
 "catalogUrl": "https://raw.githubusercontent.com/chelowek054-lgtm/FishingData/main/species/initial_fish.json",
 "knowledgeUrls": {
  "ru": "https://raw.githubusercontent.com/chelowek054-lgtm/FishingData/main/knowledge/knowledge.json",
  "en": "https://raw.githubusercontent.com/chelowek054-lgtm/FishingData/main/knowledge/knowledge_en.json"
 },
 "apiBaseUrl": "",
 "isDataCollect": false,
 "minAppVersion": "1.0.0"
}
